id;from;to;text;where;number;nouns;determiners;conjuctions;adjectives;prepositions;pronouns;verbs;adverbes;undefined;time
739;DARTH VADER;;I've been waiting for you, Obi-Wan. We meet again, at last. The circle is now complete.;INT. DEATH STAR - HALLWAY LEADING TO MAIN FORWARD BAY;16;0;0;0;0;0;0;0;0;0;
740;DARTH VADER;;"When I left you, I was but the learner; now I am the master.";INT. DEATH STAR - HALLWAY LEADING TO MAIN FORWARD BAY;14;0;0;0;0;0;0;0;0;0;
741;OBI-WAN;;Only a master of evil, Darth.;INT. DEATH STAR - HALLWAY LEADING TO MAIN FORWARD BAY;6;0;0;0;0;0;0;0;0;0;
742;DARTH VADER;;Your powers are weak, old man.;INT. DEATH STAR - HALLWAY LEADING TO MAIN FORWARD BAY;6;0;0;0;0;0;0;0;0;0;
743;OBI-WAN;;You can't win, Darth. If you strike me down, I shall become more powerful than you can possibly imagine.;INT. DEATH STAR - HALLWAY LEADING TO MAIN FORWARD BAY;19;0;0;0;0;0;0;0;0;0;
744;HAN SOLO;;Didn't we just leave this party?;INT. DEATH STAR - HALLWAY LEADING TO MAIN FORWARD BAY;6;0;0;0;0;0;0;0;0;0;
745;HAN SOLO;;What kept you?;INT. DEATH STAR - HALLWAY LEADING TO MAIN FORWARD BAY;3;0;0;0;0;0;0;0;0;0;
746;LEIA;;We ran into some old friends.;INT. DEATH STAR - HALLWAY LEADING TO MAIN FORWARD BAY;6;0;0;0;0;0;0;0;0;0;
747;LUKE;;Is the ship all right?;INT. DEATH STAR - HALLWAY LEADING TO MAIN FORWARD BAY;5;0;0;0;0;0;0;0;0;0;
748;HAN SOLO;;Seems okay, if we can get to it. Just hope the old man got the tractor beam out of commission.;INT. DEATH STAR - HALLWAY LEADING TO MAIN FORWARD BAY;20;0;0;0;0;0;0;0;0;0;
749;LUKE;;Look!;INT. DEATH STAR - HALLWAY;1;0;0;0;0;0;0;0;0;0;
750;THREEPIO;;Come on, ARTOO, we're going!;INT. DEATH STAR - HALLWAY;5;0;0;0;0;0;0;0;0;0;
751;HAN SOLO;;Now's our chance! Go!;INT. DEATH STAR - HALLWAY;4;0;0;0;0;0;0;0;0;0;
752;LUKE;;No!;INT. DEATH STAR - HALLWAY;1;0;0;0;0;0;0;0;0;0;
753;HAN SOLO;;(to Luke) Come on!;INT. DEATH STAR - HALLWAY;2;0;0;0;0;0;0;0;0;0;
754;LEIA;;Come on! Luke, its too late!;INT. DEATH STAR - HALLWAY;6;0;0;0;0;0;0;0;0;0;
755;HAN SOLO;;Blast the door! Kid!;INT. DEATH STAR - HALLWAY;4;0;0;0;0;0;0;0;0;0;
756;OBI WAN;;Run, Luke! Run!;INT. DEATH STAR - HALLWAY;3;0;0;0;0;0;0;0;0;0;
757;HAN SOLO;;I hope the old man got that tractor beam out if commission, or this is going to be a real short trip. Okay, hit it!;INT. MILLENNIUM FALCON - COCKPIT;25;0;0;0;0;0;0;0;0;0;
758;HAN SOLO;;(to Chewie) We're coming up on the sentry ships. Hold 'em off! Angle the deflector shields while I charge up the main guns!;INT. MILLENNIUM FALCON - COCKPIT;21;0;0;0;0;0;0;0;0;0;
759;LUKE;;I can't believe he's gone.;INT. MILLENNIUM FALCON - CENTRAL HOLD AREA;5;0;0;0;0;0;0;0;0;0;
760;LEIA;;There wasn't anything you could have done.;INT. MILLENNIUM FALCON - CENTRAL HOLD AREA;7;0;0;0;0;0;0;0;0;0;
761;HAN SOLO;;(to Luke) Come on, buddy, we're not out of this yet!;INT. MILLENNIUM FALCON - CENTRAL HOLD AREA;9;0;0;0;0;0;0;0;0;0;
762;HAN SOLO;;(to Luke) You in, kid? Okay, stay sharp!;INT. MILLENNIUM FALCON - SOLO'S GUNPORT;6;0;0;0;0;0;0;0;0;0;
763;LEIA;;(into intercom) Here they come!;INT. MILLENNIUM FALCON - SOLO'S GUNPORT;3;0;0;0;0;0;0;0;0;0;
764;LUKE;;They're coming in too fast!;INT. MILLENNIUM FALCON - GUNPORTS;5;0;0;0;0;0;0;0;0;0;
765;THREEPIO;;Oooh!;INT. MILLENNIUM FALCON - MAIN PASSAGEWAY;1;0;0;0;0;0;0;0;0;0;
766;LEIA;;We've lost lateral controls.;INT. MILLENNIUM FALCON - MAIN PASSAGEWAY;4;0;0;0;0;0;0;0;0;0;
767;HAN SOLO;;Don't worry, she'll hold together.;INT. MILLENNIUM FALCON - MAIN PASSAGEWAY;5;0;0;0;0;0;0;0;0;0;
768;HAN SOLO;;(to ship) You hear me, baby? Hold together!;INT. MILLENNIUM FALCON - MAIN PASSAGEWAY;6;0;0;0;0;0;0;0;0;0;
769;LUKE;;Got him! I got him!;INT. MILLENNIUM FALCON - GUNPORTS;5;0;0;0;0;0;0;0;0;0;
770;HAN SOLO;;Great kid! Don't get cocky.;INT. MILLENNIUM FALCON - GUNPORTS;5;0;0;0;0;0;0;0;0;0;
771;LEIA;;There are still two more of them out there!;INT. MILLENNIUM FALCON - GUNPORTS;9;0;0;0;0;0;0;0;0;0;
772;LUKE;;(laughing) That's it! We did it!;INT. MILLENNIUM FALCON - GUNPORT;5;0;0;0;0;0;0;0;0;0;
773;LEIA;;We did it!;INT. MILLENNIUM FALCON - GUNPORT;3;0;0;0;0;0;0;0;0;0;
774;THREEPIO;;Help! I think I'm melting! (to ARTOO) This is all your fault.;INT. MILLENNIUM FALCON - PASSAGEWAY;10;0;0;0;0;0;0;0;0;0;
775;TARKIN;;Are they away?;INT. DEATH STAR - CONTROL ROOM;3;0;0;0;0;0;0;0;0;0;
776;DARTH VADER;;They have just made the jump into hyperspace.;INT. DEATH STAR - CONTROL ROOM;8;0;0;0;0;0;0;0;0;0;
777;TARKIN;;You're sure the homing beacon is secure aboard their ship? I'm taking an awful risk, Vader. This had better work.;INT. DEATH STAR - CONTROL ROOM;20;0;0;0;0;0;0;0;0;0;
778;HAN SOLO;;Not a bad bit of rescuing, huh? You know, sometimes I even amaze myself.;INT. MILLENNIUM FALCON - COCKPIT;14;0;0;0;0;0;0;0;0;0;
779;LEIA;;That doesn't sound too hard. Besides, they let us go. It's the only explanation for the ease of our escape.;INT. MILLENNIUM FALCON - COCKPIT;20;0;0;0;0;0;0;0;0;0;
780;HAN SOLO;;Easy... you call that easy?;INT. MILLENNIUM FALCON - COCKPIT;5;0;0;0;0;0;0;0;0;0;
781;LEIA;;Their tracking us!;INT. MILLENNIUM FALCON - COCKPIT;3;0;0;0;0;0;0;0;0;0;
782;HAN SOLO;;Not this ship, sister.;INT. MILLENNIUM FALCON - COCKPIT;4;0;0;0;0;0;0;0;0;0;
783;LEIA;;At least the information in ARTOO is still intact.;INT. MILLENNIUM FALCON - COCKPIT;9;0;0;0;0;0;0;0;0;0;
784;HAN SOLO;;What's so important? What's he carrying?;INT. MILLENNIUM FALCON - COCKPIT;6;0;0;0;0;0;0;0;0;0;
785;LEIA;;The technical readouts of that battle station. I only hope that when the data is analyzed, a weakness can be found. It's not over yet!;INT. MILLENNIUM FALCON - COCKPIT;25;0;0;0;0;0;0;0;0;0;
786;HAN SOLO;;It is for me, sister! Look, I ain't in this for your revolution, and I'm not in it for you, Princess. I expect to be well paid. I'm in it for the money!;INT. MILLENNIUM FALCON - COCKPIT;33;0;0;0;0;0;0;0;0;0;
787;LEIA;;You needn't worry about your reward. If money is all that you love, then that's what you'll receive!;INT. MILLENNIUM FALCON - COCKPIT;18;0;0;0;0;0;0;0;0;0;
788;LEIA;;Your friend is quite a mercenary. I wonder if he really cares about anything... or anyone.;INT. MILLENNIUM FALCON - COCKPIT;16;0;0;0;0;0;0;0;0;0;
789;LUKE;;I care!;INT. MILLENNIUM FALCON - COCKPIT;2;0;0;0;0;0;0;0;0;0;
790;LUKE;;So... what do you think of her, Han?;INT. MILLENNIUM FALCON - COCKPIT;8;0;0;0;0;0;0;0;0;0;
791;HAN SOLO;;I'm trying not to, kid!;INT. MILLENNIUM FALCON - COCKPIT;5;0;0;0;0;0;0;0;0;0;
792;LUKE;;(under his breath) Good...;INT. MILLENNIUM FALCON - COCKPIT;1;0;0;0;0;0;0;0;0;0;
793;HAN SOLO;;Still, she's got a lot of spirit. I don't know, what do you think? Do you think a princess and a guy like me...;INT. MILLENNIUM FALCON - COCKPIT;24;0;0;0;0;0;0;0;0;0;
794;LUKE;;No!;INT. MILLENNIUM FALCON - COCKPIT;1;0;0;0;0;0;0;0;0;0;
795;WILLARD;;(holding Leia) You're safe! We had feared the worst.;INT. MASSASSI - MAIN HANGAR DECK;7;0;0;0;0;0;0;0;0;0;
796;WILLARD;;composes himself, steps back and bows formally.;INT. MASSASSI - MAIN HANGAR DECK;7;0;0;0;0;0;0;0;0;0;
797;WILLARD;;When we heard about Alderaan, we were afraid that you were... lost along with your father.;INT. MASSASSI - MAIN HANGAR DECK;16;0;0;0;0;0;0;0;0;0;
798;LEIA;;We don't have time for our sorrows, Commander. The battle station has surely tracked us here. (looking pointedly to Han) It's the only explanation for the ease of our escape. You must use the information in this R2 unit to plan the attack. It is our only hope.;INT. MASSASSI - MAIN HANGAR DECK;44;0;0;0;0;0;0;0;0;0;
799;TARKIN;;Yes.;INT. DEATH STAR - CONTROL ROOM;1;0;0;0;0;0;0;0;0;0;
800;DEATH STAR INTERCOM VOICE;;We are approaching the planet Yavin. The Rebel base is on a moon on the far side. We are preparing to orbit the planet.;INT. DEATH STAR - CONTROL ROOM;24;0;0;0;0;0;0;0;0;0;
801;DODONNA;;The battle station is heavily shielded and carries a firepower greater than half the star fleet. It's defenses are designed around a direct large-scale assault. A small one-man fighter should be able to penetrate the outer defense.;INT. DEATH STAR - CONTROL ROOM;37;0;0;0;0;0;0;0;0;0;
802;GOLD LEADER;;Pardon me for asking, sir, but what good are snub fighters going to be against that?;INT. DEATH STAR - CONTROL ROOM;16;0;0;0;0;0;0;0;0;0;
803;DODONNA;;Well, the Empire doesn't consider a small one-man fighter to be any threat, or they'd have a tighter defense. An analysis of the plans provided by Princess Leia has demonstrated a weakness in the battle station.;INT. DEATH STAR - CONTROL ROOM;36;0;0;0;0;0;0;0;0;0;
804;DODONNA;;The approach will not be easy. You are required to maneuver straight down this trench and skim the surface to this point. The target area is only two meters wide. It's a small thermal exhaust port, right below the main port. The shaft leads directly to the reactor system. A precise hit will start a chain reaction which should destroy the station.;INT. DEATH STAR - CONTROL ROOM;62;0;0;0;0;0;0;0;0;0;
805;DODONNA;;Only a precise hit will set up a chain reaction. The shaft is ray-shielded, so you'll have to use proton torpedoes.;INT. DEATH STAR - CONTROL ROOM;21;0;0;0;0;0;0;0;0;0;
806;WEDGE;;That's impossible, even for a computer.;INT. DEATH STAR - CONTROL ROOM;6;0;0;0;0;0;0;0;0;0;
807;LUKE;;It's not impossible. I used to bull's- eye womp rats in my T-sixteen back home. They're not much bigger than two meters.;INT. DEATH STAR - CONTROL ROOM;22;0;0;0;0;0;0;0;0;0;
808;DODONNA;;Man your ships! And may the Force be with you!;INT. DEATH STAR - CONTROL ROOM;10;0;0;0;0;0;0;0;0;0;
809;DEATH STAR INTERCOM VOICE;;Orbiting the planet at maximum velocity. The moon with the Rebel base will be in range in thirty minutes.;INT. DEATH STAR;19;0;0;0;0;0;0;0;0;0;
810;DARTH VADER;;This will be a day long remembered. It has seen the end of Kenobi and it will soon see the end of the Rebellion.;INT. DEATH STAR;24;0;0;0;0;0;0;0;0;0;
811;HAN SOLO;;(over loudspeaker) All flight trooper, man your stations. All flight troops, man your stations.;INT. MASSASSI OUTPOST - MAIN HANGAR DECK;12;0;0;0;0;0;0;0;0;0;
812;LUKE;;So... you got your reward and you're just leaving then?;INT. MASSASSI OUTPOST - MAIN HANGAR DECK;10;0;0;0;0;0;0;0;0;0;
813;HAN SOLO;;That's right, yeah! I got some old debts I've got to pay off with this stuff. Even if I didn't, you don't think I'd be fool enough to stick around here, do you? Why don't you come with us? You're pretty good in a fight. I could use you.;INT. MASSASSI OUTPOST - MAIN HANGAR DECK;49;0;0;0;0;0;0;0;0;0;
814;LUKE;;(getting angry) Come on! Why don't you take a look around? You know what's about to happen, what they're up against. They could use a good pilot like you. You're turning your back on them.;INT. MASSASSI OUTPOST - MAIN HANGAR DECK;33;0;0;0;0;0;0;0;0;0;
815;HAN SOLO;;What good's a reward if you ain't around to use it? Besides, attacking that battle station ain't my idea of courage. It's more like suicide.;INT. MASSASSI OUTPOST - MAIN HANGAR DECK;25;0;0;0;0;0;0;0;0;0;
816;LUKE;;All right. Well, take care of yourself, Han. I guess that's what you're best at, isn't it?;INT. MASSASSI OUTPOST - MAIN HANGAR DECK;17;0;0;0;0;0;0;0;0;0;
817;HAN SOLO;;Hey, Luke... may the Force be with you!;INT. MASSASSI OUTPOST - MAIN HANGAR DECK;8;0;0;0;0;0;0;0;0;0;
818;HAN SOLO;;What're you lookin' at? I know what I'm doing.;INT. MASSASSI OUTPOST - MAIN HANGAR DECK;9;0;0;0;0;0;0;0;0;0;
819;LEIA;;What's wrong?;INT. MAIN HANGAR DECK - LUKE'S SHIP;2;0;0;0;0;0;0;0;0;0;
820;LUKE;;Oh, it's Han! I don't know, I really thought he'd change his mind.;INT. MAIN HANGAR DECK - LUKE'S SHIP;13;0;0;0;0;0;0;0;0;0;
821;LEIA;;He's got to follow his own path. No one can choose it for him.;INT. MAIN HANGAR DECK - LUKE'S SHIP;14;0;0;0;0;0;0;0;0;0;
822;LUKE;;I only wish Ben were here.;INT. MAIN HANGAR DECK - LUKE'S SHIP;6;0;0;0;0;0;0;0;0;0;
823;BIGGS;;Luke! I don't believe it! How'd you get here... are you going out with us?!;INT. MAIN HANGAR DECK - LUKE'S SHIP;15;0;0;0;0;0;0;0;0;0;
824;LUKE;;Biggs! Of course, I'll be up there with you! Listen, have I got some stories to tell...;INT. MAIN HANGAR DECK - LUKE'S SHIP;17;0;0;0;0;0;0;0;0;0;
825;RED LEADER;;Are you... Luke Skywalker? Have you been checked out on the Incom T-sixty- five?;INT. MAIN HANGAR DECK - LUKE'S SHIP;14;0;0;0;0;0;0;0;0;0;
826;BIGGS;;Sir, Luke is the best bushpilot in the outer rim territories.;INT. MAIN HANGAR DECK - LUKE'S SHIP;11;0;0;0;0;0;0;0;0;0;
827;RED LEADER;;I met your father once when I was just a boy, he was a great pilot. You'll do all right. If you've got half of your father's skill, you'll do better than all right.;INT. MAIN HANGAR DECK - LUKE'S SHIP;34;0;0;0;0;0;0;0;0;0;
828;LUKE;;Thank you, sir. I'll try.;INT. MAIN HANGAR DECK - LUKE'S SHIP;5;0;0;0;0;0;0;0;0;0;
829;BIGGS;;I've got to get aboard. Listen, you'll tell me your stories when we come back. All right?;INT. MAIN HANGAR DECK - LUKE'S SHIP;17;0;0;0;0;0;0;0;0;0;
830;LUKE;;I told you I'd make it someday, Biggs.;INT. MAIN HANGAR DECK - LUKE'S SHIP;8;0;0;0;0;0;0;0;0;0;
831;BIGGS;;(going off) You did, all right. It's going to be like old times, Luke. We're a couple of shooting stars that'll never be stopped!;INT. MAIN HANGAR DECK - LUKE'S SHIP;22;0;0;0;0;0;0;0;0;0;
832;CHIEF;;This R2 unit of your seems a bit beat up. Do you want a new one?;INT. MAIN HANGAR DECK - LUKE'S SHIP;16;0;0;0;0;0;0;0;0;0;
833;LUKE;;Not on your life! That little droid and I have been through a lot together. (to ARTOO) You okay, ARTOO?;INT. MAIN HANGAR DECK - LUKE'S SHIP;18;0;0;0;0;0;0;0;0;0;
834;CHIEF;;Okay, easy she goes!;INT. MAIN HANGAR DECK - LUKE'S SHIP;4;0;0;0;0;0;0;0;0;0;
835;THREEPIO;;Hang on tight,ARTOO, you've got to come back.;INT. MAIN HANGAR DECK - LUKE'S SHIP;8;0;0;0;0;0;0;0;0;0;
836;THREEPIO;;You wouldn't want my life to get boring, would you?;INT. MAIN HANGAR DECK - LUKE'S SHIP;10;0;0;0;0;0;0;0;0;0;
837;OBI WAN;;Luke, the Force will be with you.;INT. MAIN HANGAR DECK - LUKE'S SHIP;7;0;0;0;0;0;0;0;0;0;
838;MASSASSI INTERCOM VOICE;;Stand-by alert. Death Star approaching. Estimated time to firing range, fifteen minutes.;INT. MASSASSI OUTPOST - WAR ROOM;12;0;0;0;0;0;0;0;0;0;
839;RED LEADER;;All wings report in.;INT. RED LEADER STARSHIP - COCKPIT;4;0;0;0;0;0;0;0;0;0;
840;RED TEN;;Red Ten standing by.;INT. ANOTHER COCKPIT;4;0;0;0;0;0;0;0;0;0;
841;RED SEVEN;;(over Biggs' headset) Red Seven standing by.;INT. BIGGS' COCKPIT;4;0;0;0;0;0;0;0;0;0;
842;BIGGS;;Red Three standing by.;INT. BIGGS' COCKPIT;4;0;0;0;0;0;0;0;0;0;
843;PORKINS;;Red Six standing by.;INT. PORKINS' COCKPIT;4;0;0;0;0;0;0;0;0;0;
844;RED NINE;;(over headset) Red Nine standing by.;INT. PORKINS' COCKPIT;4;0;0;0;0;0;0;0;0;0;
845;WEDGE;;Red Two standing by.;INT. WEDGE'S FIGHTER - COCKPIT;4;0;0;0;0;0;0;0;0;0;
846;RED ELEVEN;;(over headset) Red Eleven standing by.;INT. LUKE'S X-WING FIGHTER - COCKPIT;4;0;0;0;0;0;0;0;0;0;
847;LUKE;;Red Five standing by.;INT. LUKE'S X-WING FIGHTER - COCKPIT;4;0;0;0;0;0;0;0;0;0;
848;RED LEADER;;Lock S-foils in attack position.;INT. RED LEADER'S FIGHTER - COCKPIT;5;0;0;0;0;0;0;0;0;0;
849;READ LEADER;;(over headset) We're passing through their magnetic field.;INT. BIGGS' COCKPIT;6;0;0;0;0;0;0;0;0;0;
850;RED LEADER;;Hold tight!;INT. RED LEADER'S COCKPIT;2;0;0;0;0;0;0;0;0;0;
851;RED LEADER;;(over headset) Switch your deflectors on.;INT. LUKE'S X-WING FIGHTER - COCKPIT;4;0;0;0;0;0;0;0;0;0;
852;RED LEADER;;(over headset) Double front!;INT. ANOTHER COCKPIT;2;0;0;0;0;0;0;0;0;0;
853;WEDGE;;Look at the size of that thing!;INT. WEDGE'S COCKPIT;7;0;0;0;0;0;0;0;0;0;
854;RED LEADER;;(over headset) Cut the chatter, Red Two.;INT. WEDGE'S COCKPIT;5;0;0;0;0;0;0;0;0;0;
855;RED LEADER;;Accelerate to attack speed. This is it, boys!;INT. RED LEADER'S COCKPIT;8;0;0;0;0;0;0;0;0;0;
856;GOLD LEADER;;Red Leader, this is Gold Leader.;INT. GOLD LEADER'S COCKPIT;6;0;0;0;0;0;0;0;0;0;
857;RED LEADER;;(over headset) I copy, Gold Leader.;INT. GOLD LEADER'S COCKPIT;4;0;0;0;0;0;0;0;0;0;
858;GOLD LEADER;;We're starting for the target shaft now.;INT. GOLD LEADER'S COCKPIT;7;0;0;0;0;0;0;0;0;0;
859;RED LEADER;;We're in position. I'm going to cut across the axis and try and draw their fire.;INT. RED LEADER'S COCKPIT;16;0;0;0;0;0;0;0;0;0;
860;WEDGE;;(over war room speaker system) Heavy fire, boss! Twenty-degrees.;INT. MASSASSI OUTPOST - WAR ROOM;4;0;0;0;0;0;0;0;0;0;
861;RED LEADER;;(over speaker) I see it. Stay low.;INT. MASSASSI OUTPOST - WAR ROOM;5;0;0;0;0;0;0;0;0;0;
862;LUKE;;"This is Red Five; I'm going in!";INT. LUKE'S X-WING FIGHTER - COCKPIT;7;0;0;0;0;0;0;0;0;0;
863;BIGGS;;(over headset) Luke, pull up!;INT. LUKE'S X-WING FIGHTER - COCKPIT;3;0;0;0;0;0;0;0;0;0;
864;BIGGS;;Are you all right?;INT. BIGGS' COCKPIT;4;0;0;0;0;0;0;0;0;0;
865;LUKE;;I got a little cooked, but I'm okay.;INT. LUKE'S X-WING FIGHTER - COCKPIT;8;0;0;0;0;0;0;0;0;0;
866;ASTRO-OFFICER;;We count thirty Rebel ships, Lord Vader. But they're so small they're evading our turbo-lasers!;INT. DEATH STAR;15;0;0;0;0;0;0;0;0;0;
867;DARTH VADER;;We'll have to destroy them ship to ship. Get the crews to their fighters.;INT. DEATH STAR;14;0;0;0;0;0;0;0;0;0;
868;RED LEADER;;Luke, let me know when you're going in.;INT. READ LEADER'S X-WING FIGHTER - COCKPIT - TRAVELING;8;0;0;0;0;0;0;0;0;0;
869;LUKE;;I'm on my way in now...;INT. LUKE'S X-WING - COCKPIT - TRAVELING;6;0;0;0;0;0;0;0;0;0;
870;RED LEADER;;Watch yourself! There's a lot of fire coming from the right side of that deflection tower.;INT. LUKE'S X-WING - COCKPIT - TRAVELING;16;0;0;0;0;0;0;0;0;0;
871;LUKE;;I'm on i;INT. LUKE'S X-WING - COCKPIT - TRAVELING;3;0;0;0;0;0;0;0;0;0;
872;CONTROL OFFICER;;Squad leaders, we've picked up a new group of signals. Enemy fighters coming your way.;INT. MASSASSI OUTPOST - WAR ROO;15;0;0;0;0;0;0;0;0;0;
873;LUKE;;My scope's negative. I don't see anything.;INT. LUKE'S X-WING - COCKPIT - TRAVELING;7;0;0;0;0;0;0;0;0;0;
874;RED LEADER;;Keep up your visual scanning. With all this jamming, they'll be on top of you before your scope can pick them up.;INT. RED LEADER'S X-WING - COCKPIT - TRAVELING;22;0;0;0;0;0;0;0;0;0;
875;RED LEADER;;Biggs! You've picked one up... watch it!;INT. RED LEADER'S COCKPIT;7;0;0;0;0;0;0;0;0;0;
876;BIGGS;;I can't see it! Where is he?!;INT. RED LEADER'S COCKPIT;7;0;0;0;0;0;0;0;0;0;
877;BIGGS;;He's on me tight, I can't shake him... I can't shake him.;INT. BIGGS' COCKPIT - TRAVELIN;12;0;0;0;0;0;0;0;0;0;
878;LUKE;;Hang on, Biggs, I'm coming in.;INT. X-WING FIGHTER - COCKPIT - TRAVELING;6;0;0;0;0;0;0;0;0;0;
879;LUKE;;Got him!;INT. LUKE'S X-WING FIGHTER - COCKPIT - TRAVELING;2;0;0;0;0;0;0;0;0;0;
880;DARTH VADER;;Several fighters have broken off from the main group. Come with me!;INT. DEATH STAR;12;0;0;0;0;0;0;0;0;0;
881;BIGGS;;(over speaker) Pull in! Luke... pull in!;INT. MASSASSI OUTPOST - WAR ROOM;5;0;0;0;0;0;0;0;0;0;
882;WEDGE;;(over speaker) Watch your back, Luke!;INT. MASSASSI OUTPOST - WAR ROOM;4;0;0;0;0;0;0;0;0;0;
883;WEDGE;;(over headset) Watch your back! Fighter's above you, coming in!;INT. LUKE'S X-WING FIGHTER - COCKPIT;8;0;0;0;0;0;0;0;0;0;
884;LUKE;;I'm hit, but not bad.;INT. LUKE'S X-WING FIGHTER - COCKPIT;5;0;0;0;0;0;0;0;0;0;
885;LUKE;;ARTOO, see what you can do with it. Hang on back there.;INT. LUKE'S X-WING FIGHTER - COCKPIT;12;0;0;0;0;0;0;0;0;0;
886;RED LEADER;;(over headset) Red Six...;INT. LUKE'S X-WING - COCKPIT;2;0;0;0;0;0;0;0;0;0;
887;RED LEADER;; Can you see Red Five?;INT. MASSASSI OUTPOST - WAR ROOM;5;0;0;0;0;0;0;0;0;0;
888;RED TEN;;There's a heavy fire zone on this side. Red Five, where are you?;INT. MASSASSI OUTPOST - WAR ROOM;13;0;0;0;0;0;0;0;0;0;
889;LUKE;;I can't shake him!;INT. LUKE'S X-WING - COCKPIT;4;0;0;0;0;0;0;0;0;0;
890;WEDGE;;I'm on him, Luke!;INT. WEDGE'S COCKPIT;4;0;0;0;0;0;0;0;0;0;
891;WEDGE;;Hold on!;INT. LUKE'S X-WING - COCKPIT;2;0;0;0;0;0;0;0;0;0;
892;LUKE;;Blast it! Wedge where are you?;INT. LUKE'S X-WING - COCKPIT;6;0;0;0;0;0;0;0;0;0;
893;LUKE;;Thanks, Wedge.;INT. LUKE'S X-WING - COCKPIT;2;0;0;0;0;0;0;0;0;0;
894;BIGGS;;(over speaker) Good shooting, Wedge!;INT. MASSASSI OUTPOST - WAR ROOM;3;0;0;0;0;0;0;0;0;0;
895;GOLD LEADER;;(over speaker) Red Leader...;INT. MASSASSI OUTPOST - WAR ROOM;2;0;0;0;0;0;0;0;0;0;
896;GOLD LEADER;;This is Gold Leader. We're starting out attack run.;INT. GOLD LEADER'S Y-WING - COCKPIT;9;0;0;0;0;0;0;0;0;0;
897;RED LEADER;;(over speaker) I copy, Gold Leader. Move into position.;INT. MASSASSI OUTPOST - WAR ROOM;7;0;0;0;0;0;0;0;0;0;
898;DARTH VADER;;Stay in attack formation!;INT. DARTH VADER'S COCKPIT;4;0;0;0;0;0;0;0;0;0;
899;GOLD LEADER;;(over speaker) The exhaust post is...;INT. MASSASSI OUTPOST - WAR ROOM;4;0;0;0;0;0;0;0;0;0;
900;GOLD LEADER;;...marked and locked in!;INT. GOLD LEADER'S Y-WING - COCKPIT;4;0;0;0;0;0;0;0;0;0;
901;GOLD LEADER;;Switch power to front deflector screens.;INT. GOLD LEADER'S Y-WING - COCKPIT;6;0;0;0;0;0;0;0;0;0;
902;GOLD LEADER;;How many guns do you think, Gold Five.;INT. GOLD LEADER'S Y-WING - COCKPIT;8;0;0;0;0;0;0;0;0;0;
903;GOLD FIVE;;(over speaker) I'd say about twenty guns. Some on the surface, some on the towers.;INT. MASSASSI OUTPOST - WAR ROOM;13;0;0;0;0;0;0;0;0;0;
904;MASSASSI INTERCOM VOICE;;(over speaker) Death Star will be in range in five minutes.;INT. MASSASSI OUTPOST - WAR ROOM;9;0;0;0;0;0;0;0;0;0;
905;GOLD LEADER;;Switching to targeting computer.;INT. GOLD LEADER'S Y-WING - COCKPIT;4;0;0;0;0;0;0;0;0;0;
906;GOLD TWO;;Computer's locked. Getting a signal.;INT. GOLD TWO'S Y-WING - COCKPIT;5;0;0;0;0;0;0;0;0;0;
907;GOLD TWO;;The guns... they've stopped!;INT. GOLD TWO'S Y-WING - COCKPIT;4;0;0;0;0;0;0;0;0;0;
908;GOLD FIVE;;Stabilize your read deflectors. Watch for enemy fighters.;EXT. GOLD FIVE'S COCKPIT;8;0;0;0;0;0;0;0;0;0;
909;GOLD LEADER;;They've coming in! Three marks at two ten.;INT. GOLD LEADER'S Y-WING - COCKPIT;8;0;0;0;0;0;0;0;0;0;
910;DARTH VADER;;I'll take them myself! Cover me!;INT. DARTH VADER'S COCKPIT;6;0;0;0;0;0;0;0;0;0;
911;WINGMAN'S VOICE;;(over speaker) Yes, sir.;INT. DARTH VADER'S COCKPIT;2;0;0;0;0;0;0;0;0;0;
912;GOLD LEADER;; (into mike) I can't maneuver!;INT. GOLD LEADER'S Y-WING - COCKPIT;3;0;0;0;0;0;0;0;0;0;
913;GOLD FIVE;;Stay on target.;INT. GOLD FIVE'S Y-WING - COCKPIT;3;0;0;0;0;0;0;0;0;0;
914;GOLD LEADER;;We're too close.;INT. GOLD LEADER'S Y-WING - COCKPIT;3;0;0;0;0;0;0;0;0;0;
915;GOLD FIVE;;Stay on target!;INT. GOLD FIVE'S Y-WING - COCKPIT;3;0;0;0;0;0;0;0;0;0;
916;GOLD LEADER;;Loosen up!;INT. GOLD LEADER'S Y-WING - COCKPIT;2;0;0;0;0;0;0;0;0;0;
917;GOLD FIVE;;Gold Five to Red Leader...;INT. GOLD FIVE'S Y-WING - COCKPIT;5;0;0;0;0;0;0;0;0;0;
918;GOLD FIVE;;(over headset) Lost Tiree, lost Dutch.;INT. LUKE'S X-WING FIGHTER - COCKPIT;4;0;0;0;0;0;0;0;0;0;
919;RED LEADER;;I copy, Gold Five.;INT. RED LEADER'S COCKPIT;4;0;0;0;0;0;0;0;0;0;
920;GOLD FIVE;;They came from behind...;INT. GOLD FIVE'S Y-WING - COCKPIT;4;0;0;0;0;0;0;0;0;0;
921;OFFICER;;We've analyzed their attack, sir, and there is a danger. Should I have your ship standing by?;INT. DEATH STAR - CONTROL ROOM;17;0;0;0;0;0;0;0;0;0;
922;TARKIN;;Evacuate? In out moment of triumph? I think you overestimate their chances!;INT. DEATH STAR - CONTROL ROOM;12;0;0;0;0;0;0;0;0;0;
923;VOICE;;(over speaker) Rebel base, three minutes and closing.;INT. DEATH STAR - CONTROL ROOM;6;0;0;0;0;0;0;0;0;0;
924;RED LEADER;;Red Group, this is Red Leader.;INT. READ LEADER'S COCKPIT;6;0;0;0;0;0;0;0;0;0;
925;RED LEADER;;(over speaker) Rendezvous at mark six point one.;INT. MASSASSI OUTPOST - WAR ROOM;6;0;0;0;0;0;0;0;0;0;
926;WEDGE;;(over speaker) This is Red Two. Flying toward you.;INT. MASSASSI OUTPOST - WAR ROOM;7;0;0;0;0;0;0;0;0;0;
927;BIGGS;;(over speaker) Red Three, standing by.;INT. MASSASSI OUTPOST - WAR ROOM;4;0;0;0;0;0;0;0;0;0;
928;DODONNA;;(over headset) Red Leader, this is Base One. Keep half your group out of range for the next run.;INT. RED LEADER'S COCKPIT;17;0;0;0;0;0;0;0;0;0;
929;RED LEADER;;(over headset) Copy, Base One. Luke, take Red Two and Three. Hold up here and wait for my signal... to start your run.;INT. LUKE'S X-WING FIGHTER - COCKPIT;21;0;0;0;0;0;0;0;0;0;
930;RED LEADER;;This is it!;INT. RED LEADER'S COCKPIT;3;0;0;0;0;0;0;0;0;0;
931;RED TEN;;We should be able to see it by now.;INT. RED TEN'S COCKPIT;9;0;0;0;0;0;0;0;0;0;
932;RED LEADER;;Keep your eyes open for those fighters!;INT. RED LEADER'S COCKPIT;7;0;0;0;0;0;0;0;0;0;
933;RED TEN;;There's too much interference!;INT. RED TEN'S COCKPIT;4;0;0;0;0;0;0;0;0;0;
934;RED TEN;;Red Five, can you see them from where you are?;EXT. SPACE - DEATH STAR TRENCH;10;0;0;0;0;0;0;0;0;0;
935;LUKE;;No sign of any... wait!;INT. LUKE'S X-WING FIGHTER - COCKPIT;5;0;0;0;0;0;0;0;0;0;
936;LUKE;;(over headset) Coming in point three five.;INT. RED TEN'S COCKPIT;5;0;0;0;0;0;0;0;0;0;
937;RED TEN;;I see them.;INT. RED TEN'S COCKPIT;3;0;0;0;0;0;0;0;0;0;
938;RED LEADER;;I'm in range.;INT. RED LEADER'S COCKPIT;3;0;0;0;0;0;0;0;0;0;
939;RED LEADER;;Target's coming up!;INT. RED LEADER'S COCKPIT;3;0;0;0;0;0;0;0;0;0;
940;RED LEADER;;Just hold them off for a few seconds.;INT. RED LEADER'S COCKPIT;8;0;0;0;0;0;0;0;0;0;
941;DARTH VADER;;Close up formation.;INT. DARTH VADER'S COCKPIT;3;0;0;0;0;0;0;0;0;0;
942;RED TEN;;You'd better let her loose.;INT. RED TEN'S COCKPIT;5;0;0;0;0;0;0;0;0;0;
943;RED LEADER;;Almost there!;INT. RED LEADER'S COCKPIT;2;0;0;0;0;0;0;0;0;0;
944;RED TEN;;I can't hold them!;INT. RED TEN'S COCKPIT;4;0;0;0;0;0;0;0;0;0;
945;RED LEADER;;It's away!;INT. RED LEADER'S COCKPIT;2;0;0;0;0;0;0;0;0;0;
946;RED NINE;;(over speaker) It's a hit!;INT. MASSASSI OUTPOST - WAR ROOM;3;0;0;0;0;0;0;0;0;0;
947;RED LEADER;;(over speaker) Negative.;INT. MASSASSI OUTPOST - WAR ROOM;1;0;0;0;0;0;0;0;0;0;
948;RED LEADER;;Negative! It didn't go in. It just impacted on the surface.;INT. RED LEADER'S COCKPIT;11;0;0;0;0;0;0;0;0;0;
949;LUKE;;(over headset) Red Leader, we're right above you. Turn to point...;INT. RED LEADER'S COCKPIT;9;0;0;0;0;0;0;0;0;0;
